aliment,categorie,calories_100g,proteines_100g,omega3_100g,magnesium_100g,benefices_cerveau,conseils_consommation
Saumon,Poisson,208,25.4,1.8,29,Riche en DHA pour la mémoire et la concentration. Améliore la fluidité des membranes neuronales.,"2-3 fois par semaine, grillé ou cuit vapeur. Éviter la friture."
Noix,Fruits à coque,654,15.2,9.1,158,Excellente source d'oméga-3 végétaux. Améliore les fonctions cognitives et réduit l'inflammation cérébrale.,30g par jour maximum (une poignée). Idéal en collation ou dans les salades.
Épinards,Légumes verts,23,2.9,0.1,79,Riche en magnésium pour réguler le stress neuronal. Contient des antioxydants protégeant les neurones.,Crus en salade ou cuits rapidement. Accompagne bien les poissons gras.
Myrtilles,Fruits,57,0.7,0.1,6,Très riches en antioxydants (anthocyanes). Améliorent la mémoire et ralentissent le vieillissement cérébral.,"150g par jour. Fraîches, surgelées ou en smoothie. Parfait au petit-déjeuner."
Avocat,Fruits,160,2.0,0.1,29,Acides gras monoinsaturés pour la santé vasculaire cérébrale. Améliore la circulation sanguine vers le cerveau.,"1/2 avocat par jour. En salade, toast ou smoothie vert."
